camel-kit-knowledge/indexer/src/main/resources/rh-build-camel/errata/cves/CVE-2022-25857.json

{
  "threat_severity" : "Important",
  "public_date" : "2022-08-30T00:00:00Z",
  "bugzilla" : {
    "description" : "snakeyaml: Denial of Service due to missing nested depth limitation for collections",
    "id" : "2126789",
    "url" : "https://bugzilla.redhat.com/show_bug.cgi?id=2126789"
  },
  "cvss3" : {
    "cvss3_base_score" : "7.5",
    "cvss3_scoring_vector" : "CVSS:3.1/AV:N/AC:L/PR:N/UI:N/S:U/C:N/I:N/A:H",
    "status" : "verified"
  },
  "cwe" : "CWE-400",
  "details" : [ "The package org.yaml:snakeyaml from 0 and before 1.31 are vulnerable to Denial of Service (DoS) due missing to nested depth limitation for collections.", "A flaw was found in the org.yaml.snakeyaml package. This flaw allows an attacker to cause a denial of service (DoS) due to missing nested depth limitation for collections." ],
  "statement" : "For RHEL-8 it's downgraded to moderate because \"snakeyaml\" itself in RHEL 8 or RHEL-9 isn't shipped and \"prometheus-jmx-exporter\" is needed as build dependency. And it's not directly exploitable, hence severity marked as moderate.\nRed Hat Integration and AMQ products are not vulnerable to this flaw, so their severity has been lowered to moderate.\nRed Hat Single Sign-On uses snakeyaml from liquibase-core and is only used when performing migrations and would require administrator privileges to execute, hence severity marked as Low.\nRed Hat Fuse 7 is now in Maintenance Support Phase and details about its fix should be present soon. However, Red Hat Fuse Online (Syndesis) does will not contain the fix for this flaw.",
  "affected_release" : [ {
    "product_name" : "AMQ Clients",
    "release_date" : "2023-12-07T00:00:00Z",
    "advisory" : "RHSA-2023:7697",
    "cpe" : "cpe:/a:redhat:amq_clients:2023_q4",
    "package" : "snakeyaml"
  }, {
    "product_name" : "OCP-Tools-4.12-RHEL-8",
    "release_date" : "2023-10-30T00:00:00Z",
    "advisory" : "RHSA-2023:6172",
    "cpe" : "cpe:/a:redhat:ocp_tools:4.12::el8",
    "package" : "jenkins-2-plugins-0:4.12.1698294000-1.el8"
  }, {
    "product_name" : "OCP-Tools-4.12-RHEL-8",
    "release_date" : "2024-02-12T00:00:00Z",
    "advisory" : "RHSA-2024:0778",
    "cpe" : "cpe:/a:redhat:ocp_tools:4.12::el8",
    "package" : "jenkins-2-plugins-0:4.12.1706515741-1.el8"
  }, {
    "product_name" : "OCP-Tools-4.13-RHEL-8",
    "release_date" : "2023-10-30T00:00:00Z",
    "advisory" : "RHSA-2023:6179",
    "cpe" : "cpe:/a:redhat:ocp_tools:4.13::el8",
    "package" : "jenkins-2-plugins-0:4.13.1698292274-1.el8"
  }, {
    "product_name" : "OCP-Tools-4.13-RHEL-8",
    "release_date" : "2024-02-12T00:00:00Z",
    "advisory" : "RHSA-2024:0776",
    "cpe" : "cpe:/a:redhat:ocp_tools:4.13::el8",
    "package" : "jenkins-2-plugins-0:4.13.1706516346-1.el8"
  }, {
    "product_name" : "OCP-Tools-4.14-RHEL-8",
    "release_date" : "2023-11-16T00:00:00Z",
    "advisory" : "RHSA-2023:7288",
    "cpe" : "cpe:/a:redhat:ocp_tools:4.14::el8",
    "package" : "jenkins-2-plugins-0:4.14.1699356715-1.el8"
  }, {
    "product_name" : "OCP-Tools-4.14-RHEL-8",
    "release_date" : "2024-02-12T00:00:00Z",
    "advisory" : "RHSA-2024:0777",
    "cpe" : "cpe:/a:redhat:ocp_tools:4.14::el8",
    "package" : "jenkins-2-plugins-0:4.14.1706516441-1.el8"
  }, {
    "product_name" : "OpenShift Developer Tools and Services for OCP 4.11",
    "release_date" : "2023-05-17T00:00:00Z",
    "advisory" : "RHSA-2023:3198",
    "cpe" : "cpe:/a:redhat:ocp_tools:4.11::el8",
    "package" : "jenkins-2-plugins-0:4.11.1683009941-1.el8"
  }, {
    "product_name" : "Red Hat AMQ Broker 7",
    "release_date" : "2022-12-07T00:00:00Z",
    "advisory" : "RHSA-2022:8876",
    "cpe" : "cpe:/a:redhat:amq_broker:7",
    "package" : "snakeyaml",
    "impact" : "moderate"
  }, {
    "product_name" : "Red Hat build of Eclipse Vert.x 4.3.3",
    "release_date" : "2022-10-05T00:00:00Z",
    "advisory" : "RHSA-2022:6757",
    "cpe" : "cpe:/a:redhat:openshift_application_runtimes:1.0",
    "package" : "snakeyaml"
  }, {
    "product_name" : "Red Hat build of Quarkus Platform 2.7.6.SP1",
    "release_date" : "2022-10-13T00:00:00Z",
    "advisory" : "RHSA-2022:6941",
    "cpe" : "cpe:/a:redhat:openshift_application_runtimes:1.0",
    "package" : "snakeyaml"
  }, {
    "product_name" : "Red Hat Data Grid 8.4.0",
    "release_date" : "2022-11-17T00:00:00Z",
    "advisory" : "RHSA-2022:8524",
    "cpe" : "cpe:/a:redhat:jboss_data_grid:8",
    "package" : "snakeyaml"
  }, {
    "product_name" : "Red Hat Enterprise Linux 8",
    "release_date" : "2022-10-06T00:00:00Z",
    "advisory" : "RHSA-2022:6820",
    "cpe" : "cpe:/a:redhat:enterprise_linux:8",
    "package" : "prometheus-jmx-exporter-0:0.12.0-8.el8_6",
    "impact" : "moderate"
  }, {
    "product_name" : "Red Hat Fuse 7.11.1",
    "release_date" : "2022-11-28T00:00:00Z",
    "advisory" : "RHSA-2022:8652",
    "cpe" : "cpe:/a:redhat:jboss_fuse:7",
    "package" : "snakeyaml",
    "impact" : "moderate"
  }, {
    "product_name" : "Red Hat JBoss Enterprise Application Platform",
    "release_date" : "2022-10-05T00:00:00Z",
    "advisory" : "RHSA-2022:6825",
    "cpe" : "cpe:/a:redhat:jboss_enterprise_application_platform::el7",
    "package" : "org.yaml/snakeyaml:1.31.0.redhat-00001"
  }, {
    "product_name" : "Red Hat JBoss Enterprise Application Platform 7.1 EUS for RHEL 7",
    "release_date" : "2025-04-28T00:00:00Z",
    "advisory" : "RHSA-2025:4226",
    "cpe" : "cpe:/a:redhat:jboss_enterprise_application_platform_eus:7.1::el7",
    "package" : "eap7-activemq-artemis-0:1.5.5.016-1.redhat_00001.1.ep7.el7"
  }, {
    "product_name" : "Red Hat JBoss Enterprise Application Platform 7.1 EUS for RHEL 7",
    "release_date" : "2025-04-28T00:00:00Z",
    "advisory" : "RHSA-2025:4226",
    "cpe" : "cpe:/a:redhat:jboss_enterprise_application_platform_eus:7.1::el7",
    "package" : "eap7-artemis-native-1:1.5.5.016-1.redhat_00001.1.ep7.el7"
  }, {
    "product_name" : "Red Hat JBoss Enterprise Application Platform 7.1 EUS for RHEL 7",
    "release_date" : "2025-04-28T00:00:00Z",
    "advisory" : "RHSA-2025:4226",
    "cpe" : "cpe:/a:redhat:jboss_enterprise_application_platform_eus:7.1::el7",
    "package" : "eap7-jboss-xnio-base-0:3.5.11-1.Final_redhat_00001.1.ep7.el7"
  }, {
    "product_name" : "Red Hat JBoss Enterprise Application Platform 7.1 EUS for RHEL 7",
    "release_date" : "2025-04-28T00:00:00Z",
    "advisory" : "RHSA-2025:4226",
    "cpe" : "cpe:/a:redhat:jboss_enterprise_application_platform_eus:7.1::el7",
    "package" : "eap7-jsoup-0:1.14.2-1.redhat_00002.1.ep7.el7"
  }, {
    "product_name" : "Red Hat JBoss Enterprise Application Platform 7.1 EUS for RHEL 7",
    "release_date" : "2025-04-28T00:00:00Z",
    "advisory" : "RHSA-2025:4226",
    "cpe" : "cpe:/a:redhat:jboss_enterprise_application_platform_eus:7.1::el7",
    "package" : "eap7-undertow-0:1.4.18-14.SP13_redhat_00001.1.ep7.el7"
  }, {
    "product_name" : "Red Hat JBoss Enterprise Application Platform 7.1 EUS for RHEL 7",
    "release_date" : "2025-04-28T00:00:00Z",
    "advisory" : "RHSA-2025:4226",
    "cpe" : "cpe:/a:redhat:jboss_enterprise_application_platform_eus:7.1::el7",
    "package" : "eap7-wildfly-0:7.1.10-2.GA_redhat_00002.1.ep7.el7"
  }, {
    "product_name" : "Red Hat JBoss Enterprise Application Platform 7.1 EUS for RHEL 7",
    "release_date" : "2025-04-28T00:00:00Z",
    "advisory" : "RHSA-2025:4226",
    "cpe" : "cpe:/a:redhat:jboss_enterprise_application_platform_eus:7.1::el7",
    "package" : "eap7-woodstox-core-0:5.0.3-2.redhat_00002.1.ep7.el7"
  }, {
    "product_name" : "Red Hat JBoss Enterprise Application Platform 7.1 EUS for RHEL 7",
    "release_date" : "2025-04-28T00:00:00Z",
    "advisory" : "RHSA-2025:4226",
    "cpe" : "cpe:/a:redhat:jboss_enterprise_application_platform_eus:7.1::el7",
    "package" : "eap7-xml-security-0:2.0.10-2.redhat_00002.1.ep7.el7"
  }, {
    "product_name" : "Red Hat JBoss Enterprise Application Platform 7.3 EUS for RHEL 7",
    "release_date" : "2025-05-05T00:00:00Z",
    "advisory" : "RHSA-2025:4437",
    "cpe" : "cpe:/a:redhat:jboss_enterprise_application_platform_eus:7.3::el7",
    "package" : "eap7-activemq-artemis-0:2.9.0-10.redhat_00021.1.el7eap"
  }, {
    "product_name" : "Red Hat JBoss Enterprise Application Platform 7.3 EUS for RHEL 7",
    "release_date" : "2025-05-05T00:00:00Z",
    "advisory" : "RHSA-2025:4437",
    "cpe" : "cpe:/a:redhat:jboss_enterprise_application_platform_eus:7.3::el7",
    "package" : "eap7-gson-0:2.8.9-1.redhat_00001.1.el7eap"
  }, {
    "product_name" : "Red Hat JBoss Enterprise Application Platform 7.3 EUS for RHEL 7",
    "release_date" : "2025-05-05T00:00:00Z",
    "advisory" : "RHSA-2025:4437",
    "cpe" : "cpe:/a:redhat:jboss_enterprise_application_platform_eus:7.3::el7",
    "package" : "eap7-hal-console-0:3.2.18-1.Final_redhat_00001.1.el7eap"
  }, {
    "product_name" : "Red Hat JBoss Enterprise Application Platform 7.3 EUS for RHEL 7",
    "release_date" : "2025-05-05T00:00:00Z",
    "advisory" : "RHSA-2025:4437",
    "cpe" : "cpe:/a:redhat:jboss_enterprise_application_platform_eus:7.3::el7",
    "package" : "eap7-jboss-server-migration-0:1.7.2-14.Final_redhat_00015.1.el7eap"
  }, {
    "product_name" : "Red Hat JBoss Enterprise Application Platform 7.3 EUS for RHEL 7",
    "release_date" : "2025-05-05T00:00:00Z",
    "advisory" : "RHSA-2025:4437",
    "cpe" : "cpe:/a:redhat:jboss_enterprise_application_platform_eus:7.3::el7",
    "package" : "eap7-jboss-xnio-base-0:3.7.14-3.Final_redhat_00001.1.el7eap"
  }, {
    "product_name" : "Red Hat JBoss Enterprise Application Platform 7.3 EUS for RHEL 7",
    "release_date" : "2025-05-05T00:00:00Z",
    "advisory" : "RHSA-2025:4437",
    "cpe" : "cpe:/a:redhat:jboss_enterprise_application_platform_eus:7.3::el7",
    "package" : "eap7-wildfly-0:7.3.13-4.GA_redhat_00002.1.el7eap"
  }, {
    "product_name" : "Red Hat JBoss Enterprise Application Platform 7.3 EUS for RHEL 7",
    "release_date" : "2025-05-05T00:00:00Z",
    "advisory" : "RHSA-2025:4437",
    "cpe" : "cpe:/a:redhat:jboss_enterprise_application_platform_eus:7.3::el7",
    "package" : "eap7-woodstox-core-0:6.4.0-1.redhat_00001.1.el7eap"
  }, {
    "product_name" : "Red Hat JBoss Enterprise Application Platform 7.4 for RHEL 8",
    "release_date" : "2022-10-05T00:00:00Z",
    "advisory" : "RHSA-2022:6822",
    "cpe" : "cpe:/a:redhat:jboss_enterprise_application_platform:7.4::el8",
    "package" : "eap7-snakeyaml-0:1.31.0-1.redhat_00001.1.el8eap"
  }, {
    "product_name" : "Red Hat JBoss Enterprise Application Platform 7.4 for RHEL 9",
    "release_date" : "2022-10-05T00:00:00Z",
    "advisory" : "RHSA-2022:6823",
    "cpe" : "cpe:/a:redhat:jboss_enterprise_application_platform:7.4::el9",
    "package" : "eap7-snakeyaml-0:1.31.0-1.redhat_00001.1.el9eap"
  }, {
    "product_name" : "Red Hat JBoss Enterprise Application Platform 7.4 on RHEL 7",
    "release_date" : "2022-10-05T00:00:00Z",
    "advisory" : "RHSA-2022:6821",
    "cpe" : "cpe:/a:redhat:jboss_enterprise_application_platform:7.4::el7",
    "package" : "eap7-snakeyaml-0:1.31.0-1.redhat_00001.1.el7eap"
  }, {
    "product_name" : "Red Hat OpenShift Container Platform 4.10",
    "release_date" : "2023-02-08T00:00:00Z",
    "advisory" : "RHSA-2023:0560",
    "cpe" : "cpe:/a:redhat:openshift:4.10::el8",
    "package" : "jenkins-2-plugins-0:4.10.1675144701-1.el8"
  }, {
    "product_name" : "Red Hat OpenShift Container Platform 4.9",
    "release_date" : "2023-02-23T00:00:00Z",
    "advisory" : "RHSA-2023:0777",
    "cpe" : "cpe:/a:redhat:openshift:4.9::el8",
    "package" : "jenkins-2-plugins-0:4.9.1675668922-1.el8"
  }, {
    "product_name" : "Red Hat Satellite 6.13 for RHEL 8",
    "release_date" : "2023-05-03T00:00:00Z",
    "advisory" : "RHSA-2023:2097",
    "cpe" : "cpe:/a:redhat:satellite:6.13::el8",
    "package" : "candlepin-0:4.2.13-1.el8sat",
    "impact" : "moderate"
  }, {
    "product_name" : "Red Hat Single Sign-On 7",
    "release_date" : "2023-03-01T00:00:00Z",
    "advisory" : "RHSA-2023:1049",
    "cpe" : "cpe:/a:redhat:red_hat_single_sign_on:7.6",
    "package" : "snakeyaml",
    "impact" : "low"
  }, {
    "product_name" : "Red Hat Single Sign-On 7.6 for RHEL 7",
    "release_date" : "2023-03-01T00:00:00Z",
    "advisory" : "RHSA-2023:1043",
    "cpe" : "cpe:/a:redhat:red_hat_single_sign_on:7.6::el7",
    "package" : "rh-sso7-keycloak-0:18.0.6-1.redhat_00001.1.el7sso",
    "impact" : "low"
  }, {
    "product_name" : "Red Hat Single Sign-On 7.6 for RHEL 8",
    "release_date" : "2023-03-01T00:00:00Z",
    "advisory" : "RHSA-2023:1044",
    "cpe" : "cpe:/a:redhat:red_hat_single_sign_on:7.6::el8",
    "package" : "rh-sso7-keycloak-0:18.0.6-1.redhat_00001.1.el8sso",
    "impact" : "low"
  }, {
    "product_name" : "Red Hat Single Sign-On 7.6 for RHEL 9",
    "release_date" : "2023-03-01T00:00:00Z",
    "advisory" : "RHSA-2023:1045",
    "cpe" : "cpe:/a:redhat:red_hat_single_sign_on:7.6::el9",
    "package" : "rh-sso7-keycloak-0:18.0.6-1.redhat_00001.1.el9sso",
    "impact" : "low"
  }, {
    "product_name" : "RHEL-8 based Middleware Containers",
    "release_date" : "2023-03-01T00:00:00Z",
    "advisory" : "RHSA-2023:1047",
    "cpe" : "cpe:/a:redhat:rhosemc:1.0::el8",
    "package" : "rh-sso-7/sso76-openshift-rhel8:7.6-20"
  }, {
    "product_name" : "RHINT Camel-Springboot 3.18.3.P2",
    "release_date" : "2023-06-15T00:00:00Z",
    "advisory" : "RHSA-2023:3641",
    "cpe" : "cpe:/a:redhat:camel_spring_boot:3.18",
    "package" : "snakeyaml",
    "impact" : "moderate"
  }, {
    "product_name" : "RHINT Camel-Springboot 3.20.1",
    "release_date" : "2023-05-03T00:00:00Z",
    "advisory" : "RHSA-2023:2100",
    "cpe" : "cpe:/a:redhat:camel_spring_boot:3.20.1",
    "package" : "snakeyaml",
    "impact" : "moderate"
  }, {
    "product_name" : "RHINT Service Registry 2.3.0 GA",
    "release_date" : "2022-10-06T00:00:00Z",
    "advisory" : "RHSA-2022:6835",
    "cpe" : "cpe:/a:redhat:service_registry:2.3",
    "package" : "snakeyaml"
  }, {
    "product_name" : "RHPAM 7.13.4 async",
    "release_date" : "2023-09-05T00:00:00Z",
    "advisory" : "RHSA-2023:4983",
    "cpe" : "cpe:/a:redhat:jboss_enterprise_bpms_platform:7.13",
    "package" : "snakeyaml",
    "impact" : "moderate"
  } ],
  "package_state" : [ {
    "product_name" : "A-MQ Clients 2",
    "fix_state" : "Affected",
    "package_name" : "snakeyaml",
    "cpe" : "cpe:/a:redhat:a_mq_clients:2",
    "impact" : "low"
  }, {
    "product_name" : "Logging Subsystem for Red Hat OpenShift",
    "fix_state" : "Not affected",
    "package_name" : "openshift-logging/elasticsearch6-rhel8",
    "cpe" : "cpe:/a:redhat:logging:5"
  }, {
    "product_name" : "Red Hat A-MQ Online",
    "fix_state" : "Not affected",
    "package_name" : "snakeyaml",
    "cpe" : "cpe:/a:redhat:amq_online:1",
    "impact" : "moderate"
  }, {
    "product_name" : "Red Hat build of Debezium 1",
    "fix_state" : "Not affected",
    "package_name" : "snakeyaml",
    "cpe" : "cpe:/a:redhat:integration:1"
  }, {
    "product_name" : "Red Hat build of Quarkus",
    "fix_state" : "Affected",
    "package_name" : "snakeyaml",
    "cpe" : "cpe:/a:redhat:quarkus:2"
  }, {
    "product_name" : "Red Hat Enterprise Linux 7",
    "fix_state" : "Out of support scope",
    "package_name" : "snakeyaml",
    "cpe" : "cpe:/o:redhat:enterprise_linux:7",
    "impact" : "moderate"
  }, {
    "product_name" : "Red Hat Integration Camel K 1",
    "fix_state" : "Affected",
    "package_name" : "snakeyaml",
    "cpe" : "cpe:/a:redhat:integration:1",
    "impact" : "moderate"
  }, {
    "product_name" : "Red Hat Integration Camel Quarkus 1",
    "fix_state" : "Affected",
    "package_name" : "snakeyaml",
    "cpe" : "cpe:/a:redhat:camel_quarkus:2",
    "impact" : "moderate"
  }, {
    "product_name" : "Red Hat Integration Service Registry",
    "fix_state" : "Out of support scope",
    "package_name" : "snakeyaml",
    "cpe" : "cpe:/a:redhat:integration:1"
  }, {
    "product_name" : "Red Hat JBoss Data Grid 7",
    "fix_state" : "Out of support scope",
    "package_name" : "snakeyaml",
    "cpe" : "cpe:/a:redhat:jboss_data_grid:7"
  }, {
    "product_name" : "Red Hat JBoss Data Virtualization 6",
    "fix_state" : "Out of support scope",
    "package_name" : "snakeyaml",
    "cpe" : "cpe:/a:redhat:jboss_data_virtualization:6"
  }, {
    "product_name" : "Red Hat JBoss Enterprise Application Platform 6",
    "fix_state" : "Out of support scope",
    "package_name" : "eap6-snakeyaml",
    "cpe" : "cpe:/a:redhat:jboss_enterprise_application_platform:6"
  }, {
    "product_name" : "Red Hat JBoss Enterprise Application Platform 6",
    "fix_state" : "Out of support scope",
    "package_name" : "snakeyaml",
    "cpe" : "cpe:/a:redhat:jboss_enterprise_application_platform:6"
  }, {
    "product_name" : "Red Hat JBoss Enterprise Application Platform Expansion Pack",
    "fix_state" : "Not affected",
    "package_name" : "snakeyaml",
    "cpe" : "cpe:/a:redhat:jbosseapxp"
  }, {
    "product_name" : "Red Hat JBoss Fuse 6",
    "fix_state" : "Out of support scope",
    "package_name" : "snakeyaml",
    "cpe" : "cpe:/a:redhat:jboss_fuse:6"
  }, {
    "product_name" : "Red Hat JBoss Fuse Service Works 6",
    "fix_state" : "Out of support scope",
    "package_name" : "snakeyaml",
    "cpe" : "cpe:/a:redhat:jboss_fuse_service_works:6"
  }, {
    "product_name" : "Red Hat OpenShift Application Runtimes",
    "fix_state" : "Affected",
    "package_name" : "snakeyaml",
    "cpe" : "cpe:/a:redhat:openshift_application_runtimes:1.0"
  }, {
    "product_name" : "Red Hat OpenShift Container Platform 3.11",
    "fix_state" : "Out of support scope",
    "package_name" : "jenkins-2-plugins",
    "cpe" : "cpe:/a:redhat:openshift:3.11"
  }, {
    "product_name" : "Red Hat OpenShift Container Platform 3.11",
    "fix_state" : "Out of support scope",
    "package_name" : "openshift3/metrics-cassandra",
    "cpe" : "cpe:/a:redhat:openshift:3.11"
  }, {
    "product_name" : "Red Hat OpenShift Container Platform 3.11",
    "fix_state" : "Out of support scope",
    "package_name" : "openshift3/metrics-hawkular-metrics",
    "cpe" : "cpe:/a:redhat:openshift:3.11"
  }, {
    "product_name" : "Red Hat OpenShift Container Platform 3.11",
    "fix_state" : "Out of support scope",
    "package_name" : "openshift3/ose-metrics-cassandra",
    "cpe" : "cpe:/a:redhat:openshift:3.11"
  }, {
    "product_name" : "Red Hat OpenShift Container Platform 3.11",
    "fix_state" : "Out of support scope",
    "package_name" : "openshift3/ose-metrics-hawkular-metrics",
    "cpe" : "cpe:/a:redhat:openshift:3.11"
  }, {
    "product_name" : "Red Hat OpenShift Dev Spaces",
    "fix_state" : "Affected",
    "package_name" : "devspaces/idea-rhel8",
    "cpe" : "cpe:/a:redhat:openshift_devspaces:3"
  }, {
    "product_name" : "Red Hat OpenShift Dev Spaces",
    "fix_state" : "Affected",
    "package_name" : "devspaces/udi-rhel8",
    "cpe" : "cpe:/a:redhat:openshift_devspaces:3"
  }, {
    "product_name" : "Red Hat Satellite 6",
    "fix_state" : "Affected",
    "package_name" : "puppetserver",
    "cpe" : "cpe:/a:redhat:satellite:6",
    "impact" : "moderate"
  }, {
    "product_name" : "Red Hat support for Spring Boot",
    "fix_state" : "Affected",
    "package_name" : "snakeyaml",
    "cpe" : "cpe:/a:redhat:openshift_application_runtimes:1.0",
    "impact" : "moderate"
  }, {
    "product_name" : "streams for Apache Kafka",
    "fix_state" : "Affected",
    "package_name" : "snakeyaml",
    "cpe" : "cpe:/a:redhat:amq_streams:1",
    "impact" : "moderate"
  } ],
  "references" : [ "https://www.cve.org/CVERecord?id=CVE-2022-25857\nhttps://nvd.nist.gov/vuln/detail/CVE-2022-25857\nhttps://bitbucket.org/snakeyaml/snakeyaml/issues/525" ],
  "name" : "CVE-2022-25857",
  "csaw" : false
}

camel-kit-knowledge/indexer/src/main/resources/rh-build-camel/4.14/release-notes-quarkus.md

#### [1.6.2. Refactored .endChoice() behavior with Java DSL Copy link](#refactored_endchoice_behavior_with_java_dsl)

However, there has been some regressions from upgrading older Camel releases to 4.11, and therefore we have refactored `endChoice` to work more consistent.

#### [1.8.1. Upgrading Camel from version 4.10 to version 4.14 Copy link](#apache-camel-upgrade)

- [Upgrade guide 4.13 → 4.14](https://camel.apache.org/manual/camel-4x-upgrade-guide-4_14.html)
- [Upgrade guide 4.12 → 4.13](https://camel.apache.org/manual/camel-4x-upgrade-guide-4_13.html)
- [Upgrade guide 4.11 → 4.12](https://camel.apache.org/manual/camel-4x-upgrade-guide-4_12.html)
- [Upgrade guide 4.10 → 4.11](https://camel.apache.org/manual/camel-4x-upgrade-guide-4_11.html)